{
  "$schema": "https://json-schema.org/draft/2020-12/schema",
  "$id": "https://prosody-protocol.org/schemas/dataset-entry.schema.json",
  "title": "IML Dataset Entry",
  "description": "Schema for a single annotated entry in a Prosody Protocol training dataset. See EXECUTION_GUIDE.md Phase 10.",
  "type": "object",
  "required": [
    "id",
    "timestamp",
    "source",
    "language",
    "audio_file",
    "transcript",
    "iml",
    "emotion_label",
    "annotator",
    "consent"
  ],
  "additionalProperties": false,
  "properties": {
    "id": {
      "type": "string",
      "description": "Unique identifier for this entry (unique within the dataset).",
      "pattern": "\\S"
    },
    "timestamp": {
      "type": "string",
      "description": "ISO-8601 timestamp when the entry was created. The format is advisory: loaders warn about, but accept, other non-empty values.",
      "format": "date-time",
      "pattern": "\\S"
    },
    "source": {
      "type": "string",
      "description": "Origin of the data.",
      "enum": ["mavis", "recorded", "synthetic"]
    },
    "language": {
      "type": "string",
      "description": "BCP-47 language tag.",
      "pattern": "^[A-Za-z]{1,8}(-[A-Za-z0-9]{1,8})*$"
    },
    "audio_file": {
      "type": "string",
      "description": "Relative path to the audio file (WAV) within the dataset directory. It MUST NOT be absolute (/x, C:\\x, \\\\host\\x), contain a '..' segment, or contain a control character (U+0000-U+001F, U+007F).",
      "pattern": "^(?![/\\\\])(?![A-Za-z]:)(?![\\s\\S]*[\\x00-\\x1f\\x7f])(?![\\s\\S]*?(?:^|[/\\\\])\\.\\.(?:[/\\\\]|$))[\\s\\S]*\\S"
    },
    "transcript": {
      "type": "string",
      "description": "Plain text transcript of the audio.",
      "pattern": "\\S"
    },
    "iml": {
      "type": "string",
      "description": "IML-annotated version of the transcript. It MUST be a valid IML document.",
      "pattern": "\\S"
    },
    "speaker_id": {
      "type": ["string", "null"],
      "description": "Identifier for the speaker, or null if unknown."
    },
    "emotion_label": {
      "type": "string",
      "description": "Primary emotion label for the entry.",
      "pattern": "\\S"
    },
    "annotator": {
      "type": "string",
      "description": "Who/what created the annotation.",
      "enum": ["human", "model", "hybrid"]
    },
    "consent": {
      "type": "boolean",
      "description": "Whether explicit consent was given for this data. Entries without it MUST NOT be stored or used (spec 8.1).",
      "const": true
    },
    "metadata": {
      "type": "object",
      "description": "Optional additional metadata.",
      "additionalProperties": true
    }
  }
}
