{
  "id": "synth_008",
  "timestamp": "2025-06-01T12:00:00Z",
  "source": "synthetic",
  "language": "en-US",
  "audio_file": "audio/synth_008.wav",
  "transcript": "This thing never works properly.",
  "iml": "<utterance emotion=\"frustrated\" confidence=\"0.9\">This thing never works properly.</utterance>",
  "speaker_id": "synth_speaker",
  "emotion_label": "frustrated",
  "annotator": "model",
  "consent": true,
  "metadata": {
    "synthetic": true,
    "generator": "tests/generate_training_fixture.py",
    "tts": "espeak-ng, voice en-us",
    "speed_wpm": 190,
    "pitch": 45,
    "amplitude": 100,
    "pitch_range": "medium"
  }
}
