{
  "id": "synth_005",
  "timestamp": "2025-06-01T12:00:00Z",
  "source": "synthetic",
  "language": "en-US",
  "audio_file": "audio/synth_005.wav",
  "transcript": "Did you hear that noise outside?",
  "iml": "<utterance emotion=\"fearful\" confidence=\"0.9\">Did you hear that noise outside?</utterance>",
  "speaker_id": "synth_speaker",
  "emotion_label": "fearful",
  "annotator": "model",
  "consent": true,
  "metadata": {
    "synthetic": true,
    "generator": "tests/generate_training_fixture.py",
    "tts": "espeak-ng, voice en-us",
    "speed_wpm": 200,
    "pitch": 85,
    "amplitude": 50,
    "pitch_range": "high"
  }
}
