{
  "id": "synth_006",
  "timestamp": "2025-06-01T12:00:00Z",
  "source": "synthetic",
  "language": "en-US",
  "audio_file": "audio/synth_006.wav",
  "transcript": "Oh great, another meeting.",
  "iml": "<utterance emotion=\"sarcastic\" confidence=\"0.9\">Oh great, another meeting.</utterance>",
  "speaker_id": "synth_speaker",
  "emotion_label": "sarcastic",
  "annotator": "model",
  "consent": true,
  "metadata": {
    "synthetic": true,
    "generator": "tests/generate_training_fixture.py",
    "tts": "espeak-ng, voice en-us",
    "speed_wpm": 150,
    "pitch": 45,
    "amplitude": 65,
    "pitch_range": "x-high"
  }
}
