{
  "id": "synth_002",
  "timestamp": "2025-06-01T12:00:00Z",
  "source": "synthetic",
  "language": "en-US",
  "audio_file": "audio/synth_002.wav",
  "transcript": "I cannot believe you did that!",
  "iml": "<utterance emotion=\"angry\" confidence=\"0.9\">I cannot believe you did that!</utterance>",
  "speaker_id": "synth_speaker",
  "emotion_label": "angry",
  "annotator": "model",
  "consent": true,
  "metadata": {
    "synthetic": true,
    "generator": "tests/generate_training_fixture.py",
    "tts": "espeak-ng, voice en-us",
    "speed_wpm": 215,
    "pitch": 70,
    "amplitude": 125,
    "pitch_range": "high"
  }
}
